A1: VISTO | AC1: MAC - | AF1: MÉDIA DE AVALIAÇÃO CONTÍNUA
AC2: 1.ª P - | AF2: 1.ª PROVA PARCELAR
A3: O DIRECTOR | AC3: MP - | AF3: MÉDIA DO PROFESSOR
AC4: MT - | AF4: MÉDIA DO TRIMESTRE
A5: SILVESTRE AUGUSTO FRANCISCO | AD5: (EEF: EXCLUÍDO POR EXCESSO DE FALTAS)
A7: DATA: _________ /________________________ /____________
A9: CURSO: TÉCNICO DE INFORMÁTICA
A10: TG10AM | D10: SEXO | E10: LÍNGUA PORTUGUESA | H10: LÍNGUA INGLESA | K10: FAI | N10: ED.FISICA | Q10: MATEMÁTICA | T10: FÍSICA | W10: QUÍMICA | Z10: EMPREEND | AC10: SEAC | AF10: ELETROTECNIA | AI10: TLP | AL10: TIC | AO10: N.º
A11: N.º | B11: NOME COMPLETO | C11: PROC. | E11: M TI | F11: M TII | G11: M TIII | H11: M TI | I11: M TII | J11: M TIII | K11: M TI | L11: M TII | M11: M TIII | N11: M TI | O11: M TII | P11: M TIII | Q11: M TI | R11: M TII | S11: M TIII | T11: M TI | U11: M TII | V11: M TIII | W11: M TI | X11: M TII | Y11: M TIII | Z11: M TI | AA11: M TII | AB11: M TIII | AC11: M TI | AD11: M TII | AE11: M TIII | AF11: M TI | AG11: M TII | AH11: M TIII | AI11: M TI | AJ11: M TII | AK11: M TIII | AL11: M TI | AM11: M TII | AN11: M TIII
A12: 1 | B12: ADILSON MAKENGO CUSSANDA | D12: M | E12: 11 | K12: 11 | Q12: 12 | T12: 12 | W12: 10 | AC12: 15 | AI12: 12 | AL12: 10 | AO12: =A12 -> 1
A13: 2 | B13: AFONSO MENEZES QUETA | D13: M | E13: 11 | K13: 11 | Q13: 10 | T13: 10 | W13: 10 | AC13: 11 | AL13: 7 | AO13: =A13 -> 2
A14: 3 | B14: ANDERSON LAURINDO FRANCISCO EDUARDO | D14: M | E14: 10 | K14: 9 | Q14: 14 | T14: 10 | W14: 10 | AC14: 14 | AI14: 12 | AL14: 13 | AO14: =A14 -> 3
A15: 4 | B15: ANTÓNIO JOAQUIM PAXE FRANCISCO | D15: M | E15: 10 | K15: 11 | Q15: 11 | T15: 11 | W15: 7 | AI15: 15 | AL15: 12 | AO15: =A15 -> 4
A16: 5 | B16: DANIEL PAULO AFONSO FERNANDES | D16: M | E16: 6 | K16: 11 | Q16: 8 | T16: 10 | W16: 6 | AC16: 10 | AI16: 10 | AL16: 10 | AO16: =A16 -> 5
A17: 6 | B17: DELCIO JOSÉ DOMINGOS PEDRO | D17: M | E17: 7 | K17: 10 | Q17: 7 | T17: 10 | W17: 6 | AC17: 11 | AI17: 9 | AL17: 9 | AO17: =A17 -> 6
A18: 7 | B18: DOMINGOS GERMANO FRANCO | D18: M | E18: 11 | K18: 10 | Q18: 10 | T18: 6 | W18: 8 | AC18: 13 | AI18: 9 | AL18: 12 | AO18: =A18 -> 7
A19: 8 | B19: DOMINGOS OLIVEIRA MANZANZA | D19: M | E19: 10 | K19: 10 | Q19: 10 | T19: 6 | W19: 6 | AI19: 10 | AL19: 9 | AO19: =A19 -> 8
A20: 9 | B20: ELISA BANGO ZAMBA | D20: F | E20: 10 | K20: 16 | Q20: 16 | T20: 10 | W20: 10 | AC20: 13 | AI20: 10 | AL20: 15 | AO20: =A20 -> 9
A21: 10 | B21: ELVIO VIEGAS COIMBRA DOS SANTOS | D21: M | E21: 11 | K21: 11 | Q21: 10 | T21: 9 | W21: 13 | AC21: 12 | AI21: 10 | AL21: 11 | AO21: =A21 -> 10
A22: 11 | B22: EMILIA JERÓNIMO ANTÓNIO MOUTINHO | D22: F | E22: 10 | K22: 15 | Q22: 11 | T22: 10 | W22: 10 | AC22: 13 | AI22: 11 | AL22: 13 | AO22: =A22 -> 11
A23: 12 | B23: ESPERANÇA ANTÓNIO SIMÃO | D23: F | E23: 13 | K23: 11 | Q23: 12 | T23: 10 | W23: 8 | AC23: 13 | AI23: 12 | AL23: 13 | AO23: =A23 -> 12
A24: 13 | B24: EUGÉNIO LUKOKI ANTÓNIO | D24: M | E24: 10 | K24: 15 | Q24: 14 | T24: 10 | W24: 11 | AC24: 15 | AO24: =A24 -> 13
A25: 14 | B25: EURICO RODRIGUES CORREIA | D25: M | E25: 10 | K25: 9 | Q25: 8 | T25: 7 | W25: 6 | AC25: 10 | AI25: 8 | AL25: 9 | AO25: =A25 -> 14
A26: 15 | B26: EVÂNIA CACUMBA ANTÓNIO | D26: F | E26: 10 | K26: 12 | Q26: 12 | T26: 12 | W26: 8 | AC26: 14 | AI26: 10 | AL26: 13 | AO26: =A26 -> 15
A27: 16 | B27: FELICIA BENVINDA C. PAMBASSANGUE | D27: F | E27: 13 | K27: 13 | Q27: 11 | T27: 10 | W27: 7 | AC27: 10 | AI27: 13 | AL27: 12 | AO27: =A27 -> 16
A28: 17 | B28: FERNANDO JOSÉ NUNDA QUISSONGO | D28: M | E28: 10 | K28: 7 | Q28: 7 | T28: 10 | W28: 8 | AI28: 10 | AO28: =A28 -> 17
A29: 18 | B29: FRANCISCO CÂNDIDO CASSANGA | D29: M | E29: 11 | K29: 13 | Q29: 7 | T29: 12 | W29: 10 | AC29: 11 | AI29: 10 | AL29: 12 | AO29: =A29 -> 18
A30: 19 | B30: HERMENEGILDO VUNGE | D30: M | E30: 9 | K30: 10 | Q30: 10 | T30: 12 | W30: 5 | AI30: 11 | AL30: 11 | AO30: =A30 -> 19
A31: 20 | B31: JOSÉ CARDOSO DE ALMEIDA MARTINS | D31: M | E31: 11 | K31: 8 | Q31: 10 | T31: 12 | W31: 6 | AC31: 12 | AI31: 11 | AL31: 11 | AO31: =A31 -> 20
A32: 21 | B32: JOSÉ KILUSSI SUNGO | D32: M | E32: 10 | K32: 14 | Q32: 12 | T32: 13 | W32: 12 | AC32: 14 | AI32: 10 | AL32: 11 | AO32: =A32 -> 21
A33: 22 | B33: JOSIMAR CANHANGO DOS SANTOS | D33: M | E33: 10 | K33: 11 | Q33: 8 | T33: 6 | W33: 11 | AC33: 13 | AI33: 10 | AL33: 12 | AO33: =A33 -> 22
A34: 23 | B34: JOVETE FERNANDES JOÃO | D34: M | E34: 11 | K34: 7 | Q34: 11 | T34: 6 | W34: 10 | AC34: 12 | AI34: 12 | AL34: 13 | AO34: =A34 -> 23
A35: 24 | B35: KELSON JOQUIM CALUINGUI | D35: M | E35: 10 | K35: 10 | Q35: 8 | T35: 11 | W35: 8 | AC35: 10 | AI35: 12 | AL35: 11 | AO35: =A35 -> 24
A36: 25 | B36: MANUEL MÁRIO LEAL | D36: M | E36: 10 | K36: 10 | Q36: 7 | T36: 10 | W36: 8 | AC36: 13 | AI36: 11 | AL36: 10 | AO36: =A36 -> 25
A37: 26 | B37: MANUEL TOMÁS SABINO | D37: M | E37: 12 | K37: 10 | Q37: 11 | T37: 11 | W37: 8 | AC37: 12 | AI37: 10 | AO37: =A37 -> 26
A38: 27 | B38: MANUEL VICENTE GARCIA | D38: M | E38: 10 | K38: 10 | Q38: 10 | T38: 6 | W38: 6 | AC38: 10 | AI38: 0 | AL38: 12 | AO38: =A38 -> 27
A39: 28 | B39: MARGARETH SILVESTRE DIOGO | D39: F | E39: 11 | K39: 11 | Q39: 14 | T39: 9 | W39: 10 | AC39: 12 | AI39: 10 | AO39: =A39 -> 28
A40: 29 | B40: MÁRIO KIA DOMINGOS ESTEVES | D40: M | E40: 11 | K40: 11 | Q40: 10 | T40: 7 | W40: 6 | AC40: 12 | AL40: 8 | AO40: =A40 -> 29
A41: 30 | B41: MATEUS NEVES MATEUS | D41: M | E41: 13 | K41: 17 | Q41: 14 | T41: 7 | W41: 13 | AC41: 15 | AI41: 11 | AL41: 15 | AO41: =A41 -> 30
A42: 31 | B42: MIYAYI KIDIOKO BRUNO ANTÓNIO | D42: M | E42: 10 | K42: 14 | Q42: 14 | T42: 10 | W42: 13 | AC42: 12 | AI42: 16 | AL42: 16 | AO42: =A42 -> 31
A43: 32 | B43: PEDRO DOMINGOS FILIPE | D43: M | E43: 10 | K43: 6 | Q43: 7 | T43: 12 | W43: 8 | AI43: 11 | AL43: 11 | AO43: =A43 -> 32
A44: 33 | B44: RAFAEL NHIME CASSANGA | D44: M | E44: 10 | K44: 9 | Q44: 10 | T44: 7 | W44: 6 | AC44: 11 | AI44: 10 | AL44: 9 | AO44: =A44 -> 33
A45: 34 | B45: ROSSANA FERNANDA CASSUNGO FIGUEIRA | D45: F | E45: 13 | K45: 15 | Q45: 14 | T45: 11 | W45: 8 | AC45: 12 | AI45: 13 | AL45: 13 | AO45: =A45 -> 34
A46: 35 | B46: RÚBEM AFONSO BUMBA | D46: M | E46: 13 | K46: 13 | Q46: 11 | T46: 10 | W46: 12 | AC46: 17 | AI46: 15 | AL46: 13 | AO46: =A46 -> 35
A47: 36 | B47: SAFIRA MANUEL LEMOS | D47: F | E47: 13 | K47: 10 | Q47: 10 | T47: 10 | W47: 8 | AI47: 11 | AL47: 10 | AO47: =A47 -> 36
A48: 37 | B48: SUZANA MARCOS BEIRÃO | D48: F | E48: 12 | K48: 13 | Q48: 17 | T48: 8 | W48: 14 | AC48: 15 | AI48: 15 | AL48: 11 | AO48: =A48 -> 37
A49: 38 | B49: VILMA FULA DOMINGOS | D49: F | E49: 12 | K49: 13 | Q49: 12 | T49: 10 | W49: 12 | AC49: 14 | AI49: 11 | AL49: 13 | AO49: =A49 -> 38
A50: 39 | AO50: =A50 -> 39
E51: DOMINGOS NOY | K51: SAMBA DA CONCEIÇÃO | Q51: PINDAI | T51: ISALDINO JOÃO | W51: LUZENIO QUIMUNGA | AC51: MARIA TICOROSA | AI51: HENRIQUE GARCIA | AL51: MARIA TICOROSA
A53: DATA: ____________ DE ___________________________ DE _________________
A54: O DIRECTOR DE TURMA | I54: O COORDENADOR DO CURSO | AF54: O SUBDIRECTOR PEDAGÓGICO
A56: ___________________________________________________________________________ | I56: ___________________________________________________________________________________ | AF56: __________________________________________
I57: JOSÉ ANTONIO MATIAS | AF57: JOÃO GAILA, PhD