A1: VISTO | AC1: MAC - | AF1: MÉDIA DE AVALIAÇÃO CONTÍNUA
AC2: 1.ª P - | AF2: 1.ª PROVA PARCELAR
A3: O DIRECTOR | AC3: MP - | AF3: MÉDIA DO PROFESSOR
AC4: MT - | AF4: MÉDIA DO TRIMESTRE
A5: SILVESTRE AUGUSTO FRANCISCO | AD5: (EEF: EXCLUÍDO POR EXCESSO DE FALTAS)
A7: DATA: _________ /________________________ /____________
A9: CURSO: TÉCNICO DE INFORMÁTICA
A10: TG10BM | D10: SEXO | E10: LÍNGUA PORTUGUESA | H10: LÍNGUA INGLESA | K10: FAI | N10: ED.FISICA | Q10: MATEMÁTICA | T10: FÍSICA | W10: QUÍMICA | Z10: EMPREEND | AC10: SEAC | AF10: ELETROTECNIA | AI10: TLP | AL10: TIC | AO10: N.º
A11: N.º | B11: NOME COMPLETO | C11: PROC. | E11: M TI | F11: M TII | G11: M TIII | H11: M TI | I11: M TII | J11: M TIII | K11: M TI | L11: M TII | M11: M TIII | N11: M TI | O11: M TII | P11: M TIII | Q11: M TI | R11: M TII | S11: M TIII | T11: M TI | U11: M TII | V11: M TIII | W11: M TI | X11: M TII | Y11: M TIII | Z11: M TI | AA11: M TII | AB11: M TIII | AC11: M TI | AD11: M TII | AE11: M TIII | AF11: M TI | AG11: M TII | AH11: M TIII | AI11: M TI | AJ11: M TII | AK11: M TIII | AL11: M TI | AM11: M TII | AN11: M TIII
A12: 1 | B12: ADRIANO AGOSTINHO MATEUS | D12: M | E12: 10 | H12: 7 | K12: 15 | Q12: 7 | T12: 11 | W12: 12 | AC12: 13 | AI12: 9 | AL12: 14 | AO12: =A12 -> 1
A13: 2 | B13: ALFREDO CABRAL CANGULO | D13: M | E13: 11 | H13: 9 | K13: 15 | Q13: 10 | T13: 12 | W13: 9 | AI13: 12 | AL13: 16 | AO13: =A13 -> 2
A14: 3 | B14: ALFREDO FÉLIX SEGUNDA | D14: M | E14: 11 | H14: 10 | K14: 13 | Q14: 7 | T14: 13 | W14: 12 | AC14: 12 | AI14: 11 | AL14: 15 | AO14: =A14 -> 3
A15: 4 | B15: ANICETO INÁCIO IBANDA | D15: M | E15: 10 | H15: 11 | K15: 15 | Q15: 10 | T15: 10 | W15: 11 | AC15: 12 | AI15: 12 | AL15: 16 | AO15: =A15 -> 4
A16: 5 | B16: ANTÓNIO DA SILVA CALUNGA | D16: M | E16: 10 | H16: 9 | K16: 13 | Q16: 10 | T16: 12 | W16: 10 | AI16: 12 | AL16: 13 | AO16: =A16 -> 5
A17: 6 | B17: ANTÓNIO TOMÁS GASPAR DA SILVA | D17: M | E17: 10 | H17: 13 | K17: 13 | Q17: 13 | T17: 10 | W17: 15 | AC17: 16 | AI17: 14 | AL17: 15 | AO17: =A17 -> 6
A18: 7 | B18: ARNALDO AÚRIO FERNANDES | D18: M | E18: 6 | H18: 7 | K18: 8 | T18: 6 | W18: 7 | AO18: =A18 -> 7
A19: 8 | B19: BELMIRO MATONDO MANSONI PELENDA | D19: M | E19: 10 | H19: 10 | K19: 13 | Q19: 10 | T19: 14 | W19: 11 | AC19: 12 | AI19: 14 | AL19: 16 | AO19: =A19 -> 8
A20: 9 | B20: BIBIANA BENGUE CASTELO | D20: F | E20: 10 | H20: 10 | K20: 15 | Q20: 7 | T20: 10 | W20: 10 | AC20: 10 | AI20: 10 | AL20: 15 | AO20: =A20 -> 9
A21: 10 | B21: CELESTINO HAMILTON MARIA LÁZARO | D21: M | E21: 10 | H21: 7 | K21: 11 | Q21: 7 | T21: 8 | W21: 11 | AC21: 10 | AI21: 13 | AL21: 13 | AO21: =A21 -> 10
A22: 11 | B22: DORIVALDO PAULO FERNANDES NICOLAU | D22: M | E22: 10 | H22: 6 | K22: 14 | Q22: 7 | T22: 8 | W22: 8 | AC22: 12 | AI22: 11 | AL22: 13 | AO22: =A22 -> 11
A23: 12 | B23: EDMAR CARLOS NESSONA AFONSO | D23: M | E23: 10 | H23: 9 | K23: 12 | Q23: 10 | T23: 10 | W23: 13 | AC23: 11 | AI23: 11 | AL23: 15 | AO23: =A23 -> 12
A24: 13 | B24: EDNALDO DE ALMEIDA PEIXOTO | D24: M | E24: 10 | H24: 9 | K24: 10 | Q24: 7 | T24: 11 | W24: 8 | AI24: 11 | AO24: =A24 -> 13
A25: 14 | B25: ELOIDE ÁLVARO MPAY | D25: F | E25: 10 | H25: 12 | K25: 10 | Q25: 10 | T25: 10 | W25: 9 | AC25: 11 | AI25: 10 | AL25: 13 | AO25: =A25 -> 14
A26: 15 | B26: EUNICE ANDRÉ CAMUELE | D26: F | E26: 13 | H26: 13 | K26: 14 | Q26: 14 | T26: 15 | W26: 11 | AC26: 14 | AI26: 12 | AL26: 15 | AO26: =A26 -> 15
A27: 16 | B27: FELICIA BUNDO NDALA | D27: F | E27: 10 | H27: 11 | K27: 16 | Q27: 7 | T27: 14 | W27: 7 | AC27: 10 | AI27: 10 | AL27: 15 | AO27: =A27 -> 16
A28: 17 | B28: FERNANDO MANINTUMA ANTÓNIO | D28: M | E28: 6 | H28: 8 | K28: 6 | Q28: 7 | T28: 12 | W28: 10 | AI28: 7 | AO28: =A28 -> 17
A29: 18 | B29: FRANCISCO KASSANGA SACHILOMBO | D29: M | E29: 10 | H29: 9 | K29: 10 | Q29: 10 | T29: 10 | W29: 11 | AC29: 10 | AI29: 10 | AL29: 14 | AO29: =A29 -> 18
A30: 19 | B30: HELENA KILUANGE DOMINGOS | D30: F | E30: 11 | H30: 10 | K30: 12 | Q30: 10 | T30: 10 | W30: 10 | AC30: 11 | AI30: 10 | AL30: 15 | AO30: =A30 -> 19
A31: 20 | B31: HENRIQUE KIESSE CAXALA FERNANDO | D31: M | E31: 10 | H31: 9 | K31: 12 | T31: 9 | W31: 6 | AC31: 12 | AI31: 10 | AL31: 14 | AO31: =A31 -> 20
A32: 21 | B32: ISAAC MANANAXI TXIBUFENO | D32: M | E32: 10 | H32: 11 | K32: 14 | Q32: 10 | T32: 10 | W32: 12 | AC32: 12 | AI32: 12 | AL32: 15 | AO32: =A32 -> 21
A33: 22 | B33: JEREMIAS MANUEL DA COSTA | D33: M | E33: 11 | H33: 11 | K33: 13 | Q33: 7 | T33: 10 | W33: 10 | AC33: 11 | AI33: 11 | AL33: 15 | AO33: =A33 -> 22
A34: 23 | B34: JOÃO PAULITO BERNARDO | D34: M | E34: 11 | H34: 12 | K34: 14 | Q34: 10 | T34: 11 | W34: 11 | AC34: 10 | AI34: 10 | AL34: 16 | AO34: =A34 -> 23
A35: 24 | B35: JOSÉ FERREIRA DE SOUSA | D35: M | E35: 11 | H35: 9 | K35: 13 | Q35: 10 | T35: 13 | W35: 12 | AC35: 13 | AI35: 16 | AL35: 15 | AO35: =A35 -> 24
A36: 25 | B36: JOSÉ MIGUEL MANUEL | D36: M | E36: 10 | H36: 12 | K36: 15 | Q36: 10 | T36: 13 | W36: 11 | AC36: 11 | AI36: 10 | AO36: =A36 -> 25
A37: 26 | B37: JOSÉ PAULO MOMA | D37: M | E37: 11 | H37: 7 | K37: 13 | Q37: 7 | T37: 8 | W37: 8 | AO37: =A37 -> 26
A38: 27 | B38: LAURINDA CARVALHO DA SILVA | D38: F | E38: 11 | H38: 7 | K38: 13 | Q38: 10 | T38: 10 | W38: 8 | AC38: 11 | AL38: 14 | AO38: =A38 -> 27
A39: 28 | B39: LUCAS SAVIE NOVIDADES | D39: M | E39: 10 | H39: 10 | K39: 16 | Q39: 11 | T39: 13 | W39: 11 | AC39: 13 | AI39: 14 | AL39: 16 | AO39: =A39 -> 28
A40: 29 | B40: MANUEL DIOGO TOMÁS | D40: M | E40: 12 | H40: 10 | K40: 16 | Q40: 15 | T40: 6 | W40: 10 | AL40: 10 | AO40: =A40 -> 29
A41: 30 | B41: NATANIEL DE JESUS MANUEL DA CRUZ | D41: M | E41: 10 | H41: 12 | K41: 12 | Q41: 10 | T41: 11 | W41: 10 | AC41: 12 | AI41: 11 | AL41: 15 | AO41: =A41 -> 30
A42: 31 | B42: O´NEIL EMANUEL CHAVES BALTAZAR | D42: M | E42: 11 | H42: 10 | K42: 12 | Q42: 7 | T42: 6 | W42: 10 | AI42: 10 | AL42: 14 | AO42: =A42 -> 31
A43: 32 | B43: PAULA AGOSTINHO MATEUS | D43: F | E43: 10 | H43: 10 | K43: 14 | Q43: 10 | T43: 12 | W43: 10 | AC43: 10 | AI43: 11 | AL43: 15 | AO43: =A43 -> 32
A44: 33 | B44: PAULO DOMINGOS MIGUEL FALCÃO | D44: M | E44: 11 | H44: 10 | K44: 12 | Q44: 10 | T44: 10 | W44: 11 | AC44: 12 | AI44: 13 | AL44: 16 | AO44: =A44 -> 33
A45: 34 | B45: PAULO MASSOLO EDUARDO | D45: M | E45: 10 | H45: 9 | K45: 13 | Q45: 12 | T45: 10 | W45: 14 | AC45: 11 | AI45: 13 | AL45: 15 | AO45: =A45 -> 34
A46: 35 | B46: RITA CECÍLIA MARTINS | D46: F | E46: 11 | H46: 15 | K46: 13 | Q46: 10 | T46: 13 | W46: 10 | AC46: 11 | AI46: 14 | AL46: 15 | AO46: =A46 -> 35
A47: 36 | B47: SAMUEL DOMINGOS NETO | D47: M | E47: 10 | H47: 9 | K47: 13 | Q47: 10 | T47: 9 | W47: 10 | AI47: 11 | AL47: 14 | AO47: =A47 -> 36
A48: 37 | B48: SILVANO EDUARDO BAPTISTA | D48: M | E48: 10 | H48: 7 | K48: 12 | Q48: 6 | T48: 10 | W48: 11 | AI48: 13 | AL48: 13 | AO48: =A48 -> 37
A49: 38 | B49: SOLOMÃO PANZO FÉLIX | D49: M | E49: 7 | H49: 11 | K49: 6 | Q49: 7 | T49: 9 | W49: 11 | AC49: 13 | AI49: 14 | AL49: 14 | AO49: =A49 -> 38
A50: 39 | B50: RITA PATRICIA CADIAMINA ZAMBA | E50: 10 | H50: 8 | W50: 11 | AI50: 9 | AO50: =A50 -> 39
A51: 40 | AO51: =A51 -> 40
E52: DOMINGOS NOY | K52: SINCLETICA MATEUS | Q52: PINDARI | T52: ISALDINO JOÃO | W52: LUZENIO QUIMUNGA | AC52: MARIA TICOROSA | AI52: HENRIQUE GARCIA | AL52: MARIA TICOROSA | AO52: =A52 -> 0
A54: DATA: ____________ DE ___________________________ DE _________________
A55: O DIRECTOR DE TURMA | I55: O COORDENADOR DO CURSO | AF55: O SUBDIRECTOR PEDAGÓGICO
A57: ___________________________________________________________________________ | I57: ___________________________________________________________________________________ | AF57: __________________________________________
I58: JOSÉ ANTONIO MATIAS | AF58: JOÃO GAILA, PhD